Authors,Title,Abstract,Document Type,Year,Link,Source title,Round 3 ID,Included/Excluded,Reason,Notes
Nguyen S.; Vu T.T.; Vo H.D.,VFFINDER: A Graph-Based Approach for Automated Silent Vulnerability-Fix Identification,"The increasing reliance of software projects on third-party libraries has raised concerns about the security of these libraries due to hidden vulnerabilities. Managing these vul-nerabilities is challenging due to the time gap between fixes and public disclosures. Moreover, a significant portion of open-source projects silently fix vulnerabilities without disclosure, impacting vulnerability management. Existing tools like OWASP heavily rely on public disclosures, hindering their effectiveness in detecting unknown vulnerabilities. To tackle this problem, automated identification of vulnerability-fixing commits has emerged. However, identifying silent vulnerability fixes remains challenging. This paper presents VFFINDER, a novel graph-based approach for automated silent vulnerability fix identification. VFFINDER captures structural changes using Abstract Syntax Trees (ASTs) and represents them in annotated ASTs. VFFINDER distinguishes vulnerability-fixing commits from non-fixing ones using attention-based graph neural network models to extract structural features. We conducted experiments to evaluate VFFINDER on a dataset of 36K+ fixing and non-fixing commits in 507 real-world C/C++ projects. Our results show that VFFINDER significantly improves the state-of-the-art methods by 39-83% in Precision, 19-148% in Recall, and 30%-109% in F1. Especially, VFFINDER speeds up the silent fix identification process by up to 47% with the same review effort of 5% compared to the existing approaches.  © 2023 IEEE.",Conference paper,2023,https://www.scopus.com/inward/record.uri?eid=2-s2.0-85173098270&doi=10.1109%2fKSE59128.2023.10299438&partnerID=40&md5=32132664d3df53b29a7ef7891aaaeca6,"Proceedings - International Conference on Knowledge and Systems Engineering, KSE",68,Include,"I1.1,I1.2",
Yang J.; Ruan O.; Zhang J.,Tensor-based gated graph neural network for automatic vulnerability detection in source code,"The rapid expansion of smart devices leads to the increasing demand for vulnerability detection in the cyber security field. Writing secure source codes is crucial to protect applications and software. Recent vulnerability detection methods are mainly using machine learning and deep learning. However, there are still some challenges, how to learn accurate source code semantic embedding at the function level, how to effectively perform vulnerability detection using the learned semantic embedding of source code and how to solve the overfitting problem of learning-based models. In this paper, we consider codes as various graphs with node features and propose a tensor-based gated graph neural network called TensorGNN to produce code embedding for function-level vulnerability detection. First, we propose a high-dimensional tensor for combining different code graph representations. Second, inspired by the work of tensor technology, we propose the TensorGNN model to produce accurate code representations using the graph tensor. We evaluate our model on 7 C and C++ large open-source code corpus (e.g. SARD&NVD, Debian, SATE IV, FFmpeg, libpng&LibTiff, Wireshark and Github datasets), which contains 13 types of vulnerabilities. Our TensorGNN model improves on existing state-of-the-art works by 10%–30% on average in terms of vulnerability detection accuracy and F1, while our TensorGNN model needs less training time and model parameters. Specifically, compared with other existing works, our model reduces 25–47 times of the number of parameters and decreases 3–10 times of training time. Results of evaluations show that TensorGNN has better performance while using fewer training parameters and less training time. © 2023 John Wiley & Sons, Ltd.",Article,2023,https://www.scopus.com/inward/record.uri?eid=2-s2.0-85177856805&doi=10.1002%2fstvr.1867&partnerID=40&md5=1a569590b2491578fb19b6dbb6a325d8,Software Testing Verification and Reliability,69,Include,I1.1,
Cheng X.,Vulnerability Detection via Typestate-Guided Code Representation Learning,"Machine learning, including deep learning, has found success in various domains. Recently, the focus has shifted to using deep learning, like graph neural networks, for static vulnerability detection. Existing methods represent code as an embedding vector and train models on safe and vulnerable code patterns to predict vulnerabilities. However, these models lack precise bug detection, as they prioritize coarse-grained classification over understanding vulnerability semantics, such as typestate properties. This paper introduces an innovative typestate-guided code embedding technique for accurate static vulnerability detection. We select and retain feasible typestate sequences extracted from typestate analysis using self-supervised contrastive learning in a pretrained path embedding model. This reduces the need for labeled data in training downstream models for vulnerability detection. Evaluation on real-world projects showcases our approach’s superiority over recent learning-based approaches. It outperforms them by substantial margins across various metrics like precision, recall and F1 Score. © 2023, The Author(s), under exclusive license to Springer Nature Singapore Pte Ltd.",Conference paper,2023,https://www.scopus.com/inward/record.uri?eid=2-s2.0-85177163808&doi=10.1007%2f978-981-99-7584-6_22&partnerID=40&md5=d29b35db1d99029cafefb87159254b23,Lecture Notes in Computer Science (including subseries Lecture Notes in Artificial Intelligence and Lecture Notes in Bioinformatics),70,Exclude,E1.1,
Li W.; Li X.; Feng W.; Jin G.; Liu Z.; Jia J.,Vulnerability Detection Based on Unified Code Property Graph,"As the number of source codes grows rapidly, detecting source code vulnerabilities in current software has become an important study. Most current deep learning-based vulnerability detection technologies treat source code as a sequence, which loses the source code’s structural information, leading to many false positives in the detection results. We propose a novel source code vulnerability detection model, named UCPGVul, based on the Unified Code Property Graph (UCPG). A new graph representation, UCPG, is proposed to extract semantic features from the source code. By extracting features from UCPG, our proposed UCPGVul model can capture more vulnerability features. Experimental results on a publicly available dataset show that UCPGVul can achieve more accurate and stable detection results compared to five state-of-the-art methods. © 2023, The Author(s), under exclusive license to Springer Nature Singapore Pte Ltd.",Conference paper,2023,https://www.scopus.com/inward/record.uri?eid=2-s2.0-85172249628&doi=10.1007%2f978-981-99-6222-8_30&partnerID=40&md5=33ae0e4b5456900bb0974d21eb318e95,Lecture Notes in Computer Science (including subseries Lecture Notes in Artificial Intelligence and Lecture Notes in Bioinformatics),71,Include,I1.1,
Li X.; Xin Y.; Zhu H.; Yang Y.; Chen Y.,Cross-domain vulnerability detection using graph embedding and domain adaptation,"Vulnerability detection is an effective means to maintain cyberspace security. Machine learning methods have risen much attention in software security due to their advantage of accuracy and automation. However, current researches mainly focus on in-domain vulnerability detection where the training data and test data belong to the same domain. Due to application scenarios, coding habits, and other factors, vulnerabilities in different software projects may obey different probability distributions. This discrepancy compromises the performance of machine learning methods when they are applied to a brand-new project. To address this cold start problem, we propose a cross-domain vulnerability detection framework using graph embedding and deep domain adaption (VulGDA). It works in a variety of cross-domain fashions, including the Zero-Shot fashion that no labeled data in the target domain is available for training. VulGDA is decomposed to graph embedding and domain adaptation. At the graph embedding stage, we transform the samples in source code into graph representations where elements are directly concatenated according to their syntactic and semantic relationships. Then, we aggregate information from neighbors and edges defined in the graph into real-valued vectors. By graph embedding, VulGDA extracts comprehensive vulnerability features and compromises the challenge of long-term dependency. Aiming at the discrepancy between training data and test data, domain adaption is used to train a feature generator. This feature generator maps the graph embedding to a “deep” feature that is discriminative for vulnerability detection, and invariant to the shift between domains. We perform a systematic experiment to validate the effectiveness of VulGDA. The results show that combining graph embedding and deep domain adaptation promotes VulGDA's performance in cross-domain vulnerability detection. Compared with the state-of-the-art methods, our method has better performance under the cold start condition. © 2022",Article,2023,https://www.scopus.com/inward/record.uri?eid=2-s2.0-85145617321&doi=10.1016%2fj.cose.2022.103017&partnerID=40&md5=15b2ba79fa4afd2aa82af96a915df12e,Computers and Security,72,Include,I1.1,
Ni C.; Guo X.; Zhu Y.; Xu X.; Yang X.,Function-Level Vulnerability Detection Through Fusing Multi-Modal Knowledge,"Software vulnerabilities damage the functionality of software systems. Recently, many deep learning-based approaches have been proposed to detect vulnerabilities at the function level by using one or a few different modalities (e.g., text representation, graph-based representation) of the function and have achieved promising performance. However, some of these existing studies have not completely leveraged these diverse modalities, particularly the underutilized image modality, and the others using images to represent functions for vulnerability detection have not made adequate use of the significant graph structure underlying the images. In this paper, we propose MVulD, a multi-modal-based function-level vulnerability detection approach, which utilizes multi-modal features of the function (i.e., text representation, graph representation, and image representation) to detect vulnerabilities. Specifically, MVulD utilizes a pre-trained model (i.e., UniXcoder) to learn the semantic information of the textual source code, employs the graph neural network to distill graph-based representation, and makes use of computer vision techniques to obtain the image representation while retaining the graph structure of the function. We conducted a large-scale experiment on 25,816 functions. The experimental results show that MVulD improves four state-of-the-art baselines by 30.8%-81.3%, 12.8%-27.4%, 48.8%-115%, and 22.9%-141% in terms of F1-score, Accuracy, Precision, and PR-AUC respectively.  © 2023 IEEE.",Conference paper,2023,https://www.scopus.com/inward/record.uri?eid=2-s2.0-85179002505&doi=10.1109%2fASE56229.2023.00084&partnerID=40&md5=c4ca6b4d197b1c4cef905dbb95bbf33d,"Proceedings - 2023 38th IEEE/ACM International Conference on Automated Software Engineering, ASE 2023",73,Include,I1.1,
Xue J.; Yu Z.; Song Y.; Qin Z.; Sun X.; Wang W.,VulSAT: Source Code Vulnerability Detection Scheme Based on SAT Structure,"The number of software vulnerabilities have increased rapidly, and their forms have shown the characteristics of complexity and diversity, which has brought severe challenges to software systems. Deep learning can automatically learn the features of code and is widely used in source code vulnerability detection. Some studies treat codes as text sequences, ignoring the structural relationship between lines of code. Other studies extract the code as a graph structure, but ignore the order relationship of code lines and do not make full use of the dependencies between code lines. This paper proposes a C/C++ source code vulnerability detection scheme based on SAT (Structure-Aware Transformer) structure. It first standardizes the source code, then extracts the PDG (program dependency graph) representation of source code, next convert each node into a vector representation using sentence embedding, which retains the dependencies between nodes. Finally input it into the SAT architecture model for training, and judge whether the input program contains vulnerabilities according to the output results. We compared VulSAT with a variety of vulnerability detection methods (i.e., Devign, SySeVR, VulCNN, Checkmarx, VulDeePecker), and selected C/C++ functions in the SARD vulnerability dataset as experimental objects. The performance of accuracy rate and false positive rate has been improved to a certain extent.  © 2023 IEEE.",Conference paper,2023,https://www.scopus.com/inward/record.uri?eid=2-s2.0-85174681667&doi=10.1109%2fICSIP57908.2023.10271020&partnerID=40&md5=6303903a0553b7309b1e4efac7d12f2d,"2023 8th International Conference on Signal and Image Processing, ICSIP 2023",74,Include,I1.1,
Li Q.; Guo Z.; Li X.; Chen Q.; Zhou S.; Hu R.; Jiang Y.; Chen H.,Vulnerability Detection Based on Attention Mechanism and Deep Graph Convolutional Network,"To address the problem of incomplete graph structure features due to the lack of contextual information in existing graph neural network-based vulnerability mining methods and the problem of over-smoothing that prevents the model from learning higher-order features of the graph structure resulting in poor prediction performance, a vulnerability detection method based on deep graph convolutional networks and attention mechanism, PSG-GCNIIAT, is proposed. PSG fuses order relational graphs on the basis of program dependency graphs so that code statements have the ability to sense their contextual information, and generates embedding vectors of code lines by abstracting syntax trees to achieve deep structure feature extraction of graph nodes. GCNIIAT uses a deep graph convolutional network, GCNII, combined with a graph attention mechanism to more effectively identify graph structure features of program slices associated with vulnerabilities. The experimental results show that the vulnerability detection model GCNIIAT proposed in this paper has obvious advantages over Vuldeepecker, GCN and GGNN in accuracy and F1 value indicators, and can effectively improve the performance of program vulnerability detection. © 2023 IEEE.",Conference paper,2023,https://www.scopus.com/inward/record.uri?eid=2-s2.0-85175201336&doi=10.1109%2fSCSET58950.2023.00037&partnerID=40&md5=54036ac7d25a07f8ac86a89905b3af33,"Proceedings - 2023 International Seminar on Computer Science and Engineering Technology, SCSET 2023",75,Exclude,E3.3,Missing information about graph. Details about network are unclear
Ganz T.; Imgrund E.; Härterich M.; Rieck K.,CodeGraphSMOTE - Data Augmentation for Vulnerability Discovery,"The automated discovery of vulnerabilities at scale is a crucial area of research in software security. While numerous machine learning models for detecting vulnerabilities are known, recent studies show that their generalizability and transferability heavily depend on the quality of the training data. Due to the scarcity of real vulnerabilities, available datasets are highly imbalanced, making it difficult for deep learning models to learn and generalize effectively. Based on the fact that programs can inherently be represented by graphs and to leverage recent advances in graph neural networks, we propose a novel method to generate synthetic code graphs for data augmentation to enhance vulnerability discovery. Our method includes two significant contributions: a novel approach for generating synthetic code graphs and a graph-to-code transformer to convert code graphs into their code representation. Applying our augmentation strategy to vulnerability discovery models achieves the same originally reported F1-score with less than 20 % of the original dataset and we outperform the F1-score of prior work on augmentation strategies by up to 25.6 % in detection performance. © 2023, IFIP International Federation for Information Processing.",Conference paper,2023,https://www.scopus.com/inward/record.uri?eid=2-s2.0-85169070482&doi=10.1007%2f978-3-031-37586-6_17&partnerID=40&md5=c330a7e55e690a560e961818f726fea0,Lecture Notes in Computer Science (including subseries Lecture Notes in Artificial Intelligence and Lecture Notes in Bioinformatics),76,Include,I1.1,
Wang S.; Wang X.; Sun K.; Jajodia S.; Wang H.; Li Q.,GraphSPD: Graph-Based Security Patch Detection with Enriched Code Semantics,"With the increasing popularity of open-source software, embedded vulnerabilities have been widely propagating to downstream software. Due to different maintenance policies, software vendors may silently release security patches without providing sufficient advisories (e.g., CVE). This leaves users unaware of security patches and provides attackers good chances to exploit unpatched vulnerabilities. Thus, detecting those silent security patches becomes imperative for secure software maintenance. In this paper, we propose a graph neural network based security patch detection system named GraphSPD, which represents patches as graphs with richer semantics and utilizes a patch-tailored graph model for detection. We first develop a novel graph structure called PatchCPG to represent software patches by merging two code property graphs (CPGs) for the pre-patch and post-patch source code as well as retaining the context, deleted, and added components for the patch. By applying a slicing technique, we retain the most relevant context and reduce the size of PatchCPG. Then, we develop the first end-to-end deep learning model called PatchGNN to determine if a patch is security-related directly from its graph-structured PatchCPG. PatchGNN includes a new embedding process to convert PatchCPG into a numeric format and a new multi-attributed graph convolution mechanism to adapt diverse relationships in PatchCPG. The experimental results show GraphSPD can significantly outperform the state-of-the-art approaches on security patch detection.  © 2023 IEEE.",Conference paper,2023,https://www.scopus.com/inward/record.uri?eid=2-s2.0-85166049487&doi=10.1109%2fSP46215.2023.10179479&partnerID=40&md5=7406fabfa206c6c0509c0e2a440c0d44,Proceedings - IEEE Symposium on Security and Privacy,77,Include,"I1.1,I1.2",
Zhou X.; Pang J.; Zhang C.; Yue F.; Wang J.; Liu G.,TS-GGNN: Combining Graph and Sequence Features for Vulnerability Detection in Source Code,"Software vulnerability detection is crucial for maintaining the security and stability of software systems. In this paper, we propose a novel neural network model called TS-GGNN to address the problem of vulnerability detection in source code slices. The TS-GGNN model effectively captures both local and global features of vulnerable code by fusing sequence features with graph features. To achieve this, we utilize graph structure and sequence structure learning approaches to comprehensively extract valuable information from the source code slices. Our experiments are conducted on the SARD dataset, which consists of 61,638 code samples annotated for the presence or absence of vulnerabilities. The results demonstrate that TS-GGNN has the best vulnerability detection performance, with an accuracy of 99.4%, a precision of 98.81%, and an F1 score as high as 99.4% thereby validating the effectiveness of the TS-GGNN model in capturing features relevant to software vulnerabilities.  © 2023 IEEE.",Conference paper,2023,https://www.scopus.com/inward/record.uri?eid=2-s2.0-85163405645&doi=10.1109%2fCISCE58541.2023.10142859&partnerID=40&md5=858b0ff35c1046eeefb38744e97cc35f,"2023 5th International Conference on Communications, Information System and Computer Engineering, CISCE 2023",78,Include,"I1.1,I1.2",
Kraker W.D.; Vranken H.; Hommmersom A.,GLICE: Combining Graph Neural Networks and Program Slicing to Improve Software Vulnerability Detection,"This paper introduces the GLICE (Graph Neural Network with program slice) model for static code analysis to detect vulnerabilities in source code. GLICE combines inter-procedural program slicing with a Graph Neural Network. It builds upon and extends prior work that applies program slicing (as in the SySeVR model) and Graph Neural Networks (as in the FUNDED model) for vulnerability detection. We apply GLICE on a data set of C/C++ code samples with out-of-bounds write (CWE-787) and out-of-bounds read (CWE-125) butter overflow vulnerabilities. We perform experiments with GLICE to evaluate trade-offs in the depth of the inter-procedural analysis, and to compare GLICE with prior models by evaluating the effectiveness for vulnerability detection and the usage of resources. Our experimental results show that detection accuracy of GLICE improves up to 13% when compared to FUNDED, while the time required to train the GLICE model is about 9 times smaller. GLICE allows configuring the depth of the interprocedural analysis. Our experimental results show that increasing the depth will improve detection, which however requires more computing resources. This allows a user of GLICE to steer the trade-off between detection accuracy and computational efficiency.  © 2023 IEEE.",Conference paper,2023,https://www.scopus.com/inward/record.uri?eid=2-s2.0-85168239975&doi=10.1109%2fEuroSPW59978.2023.00009&partnerID=40&md5=8defe123556105593a18ef221e5cdfa6,"Proceedings - 8th IEEE European Symposium on Security and Privacy Workshops, Euro S and PW 2023",79,Exclude,E3.2,
Wang J.; Huang M.; Nie Y.; Kuang X.; Li X.; Zhong W.,Fine-Grained Source Code Vulnerability Detection via Graph Neural Networks,"Although the number of exploitable vulnerabilities in software continues to increase, the speed of bug fixes and software updates have not increased accordingly. It is therefore crucial to analyze the source code and identify vulnerabilities in the early phase of software development. However, vulnerability location in most of the current machine learning-based methods tends to concentrate at the function level. It undoubtedly imposes a burden on further manual code audits when faced with large-scale source code projects. In this paper, a fine-grained source code vulnerability detection model based on Graph Neural Networks (GNNs) is proposed with the aim of locating vulnerabilities at the function level and line level. Our empirical evaluation on different C/C++ datasets demonstrated that our proposed model outperforms the state-of-the-art methods and achieves significant improvements even when faced with more complex, real-project source code. © 2023 Knowledge Systems Institute Graduate School. All rights reserved.",Conference paper,2023,https://www.scopus.com/inward/record.uri?eid=2-s2.0-85170065533&doi=10.18293%2fSEKE2023-115&partnerID=40&md5=0394a3677f82786986e04fcdec1fee65,"Proceedings of the International Conference on Software Engineering and Knowledge Engineering, SEKE",80,Include,I1.1,
Zhang H.; Kishi T.,Long Method Detection Using Graph Convolutional Networks,"Long Method is a code smell that frequently happens in software development, which refers to the com-plex method with multiple functions. Detecting and refactoring such problems has been a popular topic in software refactoring, and many detection approaches have been proposed. In past years, the approaches based on metrics or rules have been the leading way in long method detection. However, the approach based on deep learning has also attracted extensive attention in recent studies. In this paper, we propose a graph-based deep learning approach to de-tect Long Method. The key point of our approach is that we extended the PDG (Program Dependency Graph) into a Directed-Heterogeneous Graph as the input graph and used the GCN (Graph Convolutional Network) to build a graph neural network for Long Method detection. Moreover, to get substantial data samples for the deep learning task, we propose a novel semi-automatic approach to generate a large number of data samples. Finally, to prove the validity of our approach, we compared our approach with the existing approaches based on five groups of datasets manually reviewed. The evaluation result shows that our approach achieved a good performance in Long Method detection. © 2023, Information Processing Society of Japan. All rights reserved.",Article,2023,https://www.scopus.com/inward/record.uri?eid=2-s2.0-85169480537&doi=10.2197%2fipsjjip.31.469&partnerID=40&md5=64c615bceca1579d612103656725e595,Journal of Information Processing,81,Include,"I1.1,I1.2",
