Authors,Title,Abstract,Document Type,Year,Link,Source title,Round 3 ID,Included/Excluded,Reason,Notes
Shi K.; Lu Y.; Chang J.; Wei Z.,PathPair2Vec: An AST path pair-based code representation method for defect prediction,"Software project defect prediction (SDP) can predict the bug probability of software by their features and allocate their testing efforts. The existing software defect prediction methods can be divided into two categories: methods based on traditional handcrafted features and methods based on automatically made abstract features, especially those made by deep learning. The current research indicates that deep learning-based automatic features can achieve better performance than handcrafted features. Code2vec (Alon et al. 2019) is one of the best source code representation models, which leverages deep learning to learn automatic representations from code. In this paper, inspired by code2vec, we propose a new AST path pair-based source code representation method (PathPair2Vec) and apply it to software project defect prediction. We first propose the concept of the short path to describe each terminal node and its control logic. Then, we design a new sequence encoding method to code the different parts of the terminal node and its control logic. Finally, by pairs of short paths, we describe the semantic information of code and fuse them by an attention mechanism. Experiments on the PROMISE dataset show that our method improves the F1 score by 17.88% over the state-of-the-art SDP method, and the AST path pair-based source code representation can better identify the defect features of the source code. © 2020 Elsevier Ltd",Article,2020,https://www.scopus.com/inward/record.uri?eid=2-s2.0-85085928963&doi=10.1016%2fj.cola.2020.100979&partnerID=40&md5=2f38eee29116449336d8e934062d0794,Journal of Computer Languages,137,Include,I1.1,
Zhang X.; Lu Y.; Shi K.,CB-Path2Vec: A Cross Block Path Based Representation for Software Defect Prediction,"Software defects are common in software projects and threaten the security of software. Software defect prediction has been proven to be an effective method to solve software security problems, assisting developers in finding potential errors and effectively allocating test resources, in the early stage of the software life cycle. Traditional defect prediction models are designed based on hand-designed metric features, but these features usually cannot capture the semantic and structural information of code. In order to solve this problem, this paper proposes a novel software defect prediction model called CB-Path2Vec, which can automatically learn features composed of Cross Block path for representing source code and use them for software defect prediction. An evaluation on the public PROMISE dataset shows that on average CB-Path2Vec improvements over the state-of-the-art method both on within-project defect prediction (WPDP) and cross-project defect prediction (CPDP). © 2020 IEEE.",Conference paper,2020,https://www.scopus.com/inward/record.uri?eid=2-s2.0-85101683378&doi=10.1109%2fICCC51575.2020.9344956&partnerID=40&md5=168573d2392fdb2ab881db7e179d77a4,"2020 IEEE 6th International Conference on Computer and Communications, ICCC 2020",138,Include,I1.1,
Yasunaga M.; Liang P.,"Graph-based, self-supervised program repair from diagnostic feedback","We consider the problem of learning to repair programs from diagnostic feedback (e.g., compiler error messages). Program repair is challenging for two reasons: First, it requires reasoning and tracking symbols across source code and diagnostic feedback. Second, labeled datasets available for program repair are relatively small. In this work, we propose novel solutions to these two challenges. First, we introduce a program-feedback graph, which connects symbols relevant to program repair in source code and diagnostic feedback, and then apply a graph neural network on top to model the reasoning process. Second, we present a self-supervised learning paradigm for program repair that leverages unlabeled programs available online to create a large amount of extra program repair examples, which we use to pre-train our models. We evaluate our proposed approach on two applications: correcting introductory programming assignments (DeepFix dataset) and correcting the outputs of program synthesis (SPoC dataset). Our final system, DrRepair, significantly outperforms prior work, achieving 68.2% full repair rate on DeepFix (+22.9% over the prior best), and 48.4% synthesis success rate on SPoC (+3.7% over the prior best). Copyright 2020 by the author(s).",Conference paper,2020,https://www.scopus.com/inward/record.uri?eid=2-s2.0-85094774454&partnerID=40&md5=8d54ec79554fc63afde98c2a36893a75,"37th International Conference on Machine Learning, ICML 2020",139,Include,"I1.1,I1.2",
Loyola P.; Matsuo Y.,Learning Feature Representations from Change Dependency Graphs for Defect Prediction,"Given the heterogeneity of the data that can be extracted from the software development process, defect prediction techniques have focused on associating different sources of data with the introduction of faulty code, usually relying on handcrafted features. While these efforts have generated considerable progress over the years, little attention has been given to the fact that the performance of any predictive model depends heavily on the representation of the data used, and that different representations can lead to different results. We consider this a relevant problem, as it could be affecting directly the efforts towards generating safer software systems. Therefore, we propose to study the impact of the representation of the data in defect prediction models. To this end, we focus on the use of developer activity data, from which we structure dependency graphs. Then, instead of manually generating features, such as network metrics, we propose two models inspired by recent advances in representation learning which are able to automatically generate feature representations from graph data. These new representations are compared against manually crafted features for defect prediction in real world software projects. Our results show that automatically learned features are competitive, reaching increments in prediction performance up to 13%. © 2017 IEEE.",Conference paper,2017,https://www.scopus.com/inward/record.uri?eid=2-s2.0-85040798659&doi=10.1109%2fISSRE.2017.30&partnerID=40&md5=1717868172cec4ce3bd9499ccd62e29c,"Proceedings - International Symposium on Software Reliability Engineering, ISSRE",140,Include,I1.1,
Orvalho P.; Piepenbrock J.; Janota M.; Manquinho V.,Graph Neural Networks for Mapping Variables Between Programs,"Automated program analysis is a pivotal research domain in many areas of Computer Science - Formal Methods and Artificial Intelligence, in particular. Due to the undecidability of the problem of program equivalence, comparing two programs is highly challenging. Typically, in order to compare two programs, a relation between both programs' sets of variables is required. Thus, mapping variables between two programs is useful for a panoply of tasks such as program equivalence, program analysis, program repair, and clone detection. In this work, we propose using graph neural networks (GNNs) to map the set of variables between two programs based on both programs' abstract syntax trees (ASTs). To demonstrate the strength of variable mappings, we present three use-cases of these mappings on the task of program repair to fix well-studied and recurrent bugs among novice programmers in introductory programming assignments (IPAs). Experimental results on a dataset of 4166 pairs of incorrect/correct programs show that our approach correctly maps 83% of the evaluation dataset. Moreover, our experiments show that the current state-of-the-art on program repair, greatly dependent on the programs' structure, can only repair about 72% of the incorrect programs. In contrast, our approach, which is solely based on variable mappings, can repair around 88.5%. © 2023 The Authors.",Conference paper,2023,https://www.scopus.com/inward/record.uri?eid=2-s2.0-85175817799&doi=10.3233%2fFAIA230468&partnerID=40&md5=bad761c4241bb9c0564fa129bd2312a8,Frontiers in Artificial Intelligence and Applications,141,Include,"I1.1,I1.2",
Romanov V.; Ivanov V.,Assessing the Importance of Global Relationships for Source Code Analysis Using Graph Neural Networks,"Representing the source code as a sequence of tokens does not capture long-distance dependencies and inter-project dependencies. In this study, we analyze to which extent inter-project (global) relationships can be used in machine learning tasks related to source code analysis. Our findings show that information implicitly stored in inter-project relationships can be used to select the next called function among candidates with an accuracy of 92%. We demonstrate that source code embeddings achieve the best performance on transfer learning tasks when they are computed with graph neural networks in a multitask mode. © 2023, The Author(s), under exclusive license to Springer Nature Switzerland AG.",Conference paper,2023,https://www.scopus.com/inward/record.uri?eid=2-s2.0-85164256776&doi=10.1007%2f978-3-031-35501-1_44&partnerID=40&md5=a05fe0297af81215f9c24d1f6f3e2057,Lecture Notes in Networks and Systems,142,Include,,Don't understand the classification tasks
Vytovtov P.; Chuvilin K.,Unsupervised classifying of software source code using graph neural networks,Usually automated programming systems consist of two parts: Source code analysis and source code generation. This paper is focused on the first part. Automated source code analysis can be useful for errors and vulnerabilities searching and for representing source code snippets for further investigating. Also gotten representations can be used for synthesizing source code snippets of certain types. A machine learning approach is used in this work. The training set is formed by augmented abstract syntax trees of Java classes. A graph autoencoder is trained and a latent representation of Java classes graphs is inspected. Experiments showed that the proposed model can split Java classes graphs to common classes with some business logic implementation and interfaces and utility classes. The results are good enough be used for more accurate software source code generation. © 2019 FRUCT.,Conference paper,2019,https://www.scopus.com/inward/record.uri?eid=2-s2.0-85066427020&doi=10.23919%2fFRUCT.2019.8711909&partnerID=40&md5=321504e348d93cb779e51a5c899811fc,"Conference of Open Innovation Association, FRUCT",143,Include,I1.1,Unclear how their networks works _exactly_
Allamanis M.; Brockschmidt M.; Khademi M.,Learning to represent programs with graphs,"Learning tasks on source code (i.e., formal languages) have been considered recently, but most work has tried to transfer natural language methods and does not capitalize on the unique opportunities offered by code’s known sematics. For example, long-range dependencies induced by using the same variable or function in distant locations are often not considered. We propose to use graphs to represent both the syntactic and semantic structure of code and use graph-based deep learning methods to learn to reason over program structures. In this work, we present how to construct graphs from source code and how to scale Gated Graph Neural Networks training to such large graphs. We evaluate our method on two tasks: VARNAMING, in which a network attempts to predict the name of a variable given its usage, and VARMISUSE, in which the network learns to reason about selecting the correct variable that should be used at a given program location. Our comparison to methods that use less structured program representations shows the advantages of modeling known structure, and suggests that our models learn to infer meaningful names and to solve the VARMISUSE task in many cases. Additionally, our testing showed that VARMISUSE identifies a number of bugs in mature open-source projects. © Learning Representations, ICLR 2018 - Conference Track Proceedings.All right reserved.",Conference paper,2018,https://www.scopus.com/inward/record.uri?eid=2-s2.0-85083951710&partnerID=40&md5=db31acc270c475e5034bdd2dae64f154,"6th International Conference on Learning Representations, ICLR 2018 - Conference Track Proceedings",144,Include,I1.1,
Guo J.; Liu J.; Liu X.; Wan Y.; Li L.,Summarizing source code with Heterogeneous Syntax Graph and dual position,"Code summarization attempts to summarize the semantics of source code by automatically producing brief natural-language descriptions. Most existing work proposes to learn from the Abstract Syntax Tree (AST) and plain text of source code for summary generation. However, little attention has been paid to the structural heterogeneity and layout features of source code. In this paper, we present a novel framework titled HETSUM to address these issues. Specifically, a Heterogeneous Syntax Graph (HSG) is first built by designing six types of augmented edges in AST, which indicates the heterogeneous structure of source code. Meanwhile, a dual position is designed for each token in the source code by considering the layout information. Moreover, we develop a heterogeneous graph neural network in HETSUM to encode the HSG while extracting the code layout features with the Transformer encoder. By assimilating the learned code token vectors into the HSG encoder, HETSUM can capture the relations between its two encoders for improved code representation. To facilitate the generation of high-quality summaries, we integrate a copying mechanism into the decoding procedure while expanding the Transformer decoding sublayer. Extensive experiments on the Java and Python datasets prove that HETSUM is superior to seventeen state-of-the-art baselines. To promote reproducibility studies, we make the implementation of HETSUM available at https://github.com/GJCEXP/HETSUM. © 2023 Elsevier Ltd",Article,2023,https://www.scopus.com/inward/record.uri?eid=2-s2.0-85166740779&doi=10.1016%2fj.ipm.2023.103415&partnerID=40&md5=dc4459ca66428a5d71d2096ab6bda77c,Information Processing and Management,145,Include,"I1.1,I1.2",
Guo J.; Liu J.; Liu X.; Li L.,Summarizing source code through heterogeneous feature fusion and extraction,"Code summarization, which seeks to automatically produce a succinct natural-language description to summarize the functionality of source code, plays an essential role in maintaining the software. Currently, plentiful approaches have been proposed to first encode the source code based on its Abstract Syntax Tree (AST), and then decode it into a textual summary. However, most existing works interpret the AST-based syntax structure as a homogeneous graph, without discriminating the different relations between graph nodes (e.g., the parent–child and sibling relations) in a heterogeneous way. To mitigate this issue, this paper proposes HETCOS to extract the syntactic and sequential features of source code by exploring its inherent heterogeneity for code summarization. Specifically, we first build a Heterogeneous Code Graph (HCG) that fuses the syntax structure and code sequence with eight types of edges/relations designed between graph nodes. Moreover, we present a heterogeneous graph neural network for capturing the diverse relations in HCG. The represented HCG is then fed into a Transformer decoder, followed by a multi-head attention-based copying mechanism to support high-quality summary generation. Extensive experiments on the major Java and Python datasets illustrate the superiority of our approach over sixteen state-of-the-art baselines. To promote reproducibility studies, we make the implementation of HETCOS publicly accessible at https://github.com/GJCEXP/HETCOS. © 2023 Elsevier B.V.",Article,2024,https://www.scopus.com/inward/record.uri?eid=2-s2.0-85175065989&doi=10.1016%2fj.inffus.2023.102058&partnerID=40&md5=09eece79fe63cf31d6e773c7b9b352cd,Information Fusion,146,Include,"I1.1,I1.2",
Shi C.; Cai B.; Zhao Y.; Gao L.; Sood K.; Xiang Y.,CoSS: Leveraging Statement Semantics for Code Summarization,"Automated code summarization tools allow generating descriptions for code snippets in natural language, which benefits software development and maintenance. Recent studies demonstrate that the quality of generated summaries can be improved by using additional code representations beyond token sequences. The majority of contemporary approaches mainly focus on extracting code syntactic and structural information from abstract syntax trees (ASTs). However, from the view of macro-structures, it is challenging to identify and capture semantically meaningful features due to fine-grained syntactic nodes involved in ASTs. To fill this gap, we investigate how to learn more code semantics and control flow features from the perspective of code statements. Accordingly, we propose a novel model entitled CoSS for code summarization. CoSS adopts a Transformer-based encoder and a graph attention network-based encoder to capture token-level and statement-level semantics from code token sequence and control flow graph, respectively. Then, after receiving two-level embeddings from encoders, a joint decoder with a multi-head attention mechanism predicts output sequences verbatim. Performance evaluations on Java, Python, and Solidity datasets validate that CoSS outperforms nine state-of-the-art (SOTA) neural code summarization models in effectiveness and is competitive in execution efficiency. Further, the ablation study reveals the contribution of each model component.  © 1976-2012 IEEE.",Article,2023,https://www.scopus.com/inward/record.uri?eid=2-s2.0-85151331220&doi=10.1109%2fTSE.2023.3256362&partnerID=40&md5=f688da43a2e74f73561d98236d57f320,IEEE Transactions on Software Engineering,147,Include,I1.1,
Zeng J.; Qu Z.; Cai B.,Structure and Sequence Aligned Code Summarization with Prefix and Suffix Balanced Strategy,"Source code summarization focuses on generating qualified natural language descriptions of a code snippet (e.g., functionality, usage and version). In an actual development environment, descriptions of the code are missing or not consistent with the code due to human factors, which makes it difficult for developers to comprehend and conduct subsequent maintenance. Some existing methods generate summaries from the sequence information of code without considering the structural information. Recently, researchers have adopted the Graph Neural Networks (GNNs) to capture the structural information with modified Abstract Syntax Trees (ASTs) to comprehensively represent a source code, but the alignment method of the two information encoder is hard to decide. In this paper, we propose a source code summarization model named SSCS, a unified transformer-based encoder–decoder architecture, for capturing structural and sequence information. SSCS is designed upon a structure-induced transformer with three main novel improvements. SSCS captures the structural information in a multi-scale aspect with an adapted fusion strategy and adopts a hierarchical encoding strategy to capture the textual information from the perspective of the document. Moreover, SSCS utilizes a bidirectional decoder which generates a summary from opposite direction to balance the generation performance between prefix and suffix. We conduct experiments on two public Java and Python datasets to evaluate our method and the result show that SSCS outperforms the state-of-art code summarization methods. © 2023 by the authors.",Article,2023,https://www.scopus.com/inward/record.uri?eid=2-s2.0-85156244162&doi=10.3390%2fe25040570&partnerID=40&md5=e6b87370ba5285c63b699000de0567f2,Entropy,148,Include,I1.1,
Guo J.; Liu J.; Liu X.; Wan Y.; Zhao Y.; Li L.; Liu K.; Klein J.; Bissyandé T.F.,PyScribe–Learning to describe python code,"Code comment generation, which attempts to summarize the functionality of source code in textual descriptions, plays an important role in automatic software development research. Currently, several structural neural networks have been exploited to preserve the syntax structure of source code based on abstract syntax trees (ASTs). However, they can not well capture both the long-distance and local relations between nodes while retaining the overall structural information of AST. To mitigate this problem, we present a prototype tool titled PyScribe, which extends the Transformer model to a new encoder-decoder-based framework. Particularly, the triplet position is designed and integrated into the node-level and edge-level structural features of AST for producing Python code comments automatically. This paper, to the best of our knowledge, makes the first effort to model the edges of AST as an explicit component for improved code representation. By specifying triplet positions for each node and edge, the overall structural information can be well preserved in the learning process. Moreover, the captured node and edge features go through a two-stage decoding process to yield higher qualified comments. To evaluate the effectiveness of PyScribe, we resort to a large dataset of code-comment pairs by mining Jupyter Notebooks from GitHub, for which we have made it publicly available to support further studies. The experimental results reveal that PyScribe is indeed effective, outperforming the state-ofthe-art by achieving an average BLEU score (i.e., av-BLEU) of (Formula presented.) 0.28. © 2023 The Authors. Software: Practice and Experience published by John Wiley & Sons Ltd.",Article,2023,https://www.scopus.com/inward/record.uri?eid=2-s2.0-85179352137&doi=10.1002%2fspe.3291&partnerID=40&md5=a6f06e9e93298b54afb8224fcc63ac0b,Software - Practice and Experience,149,Include,I1.1,
Zeng J.; He Y.; Zhang T.; Xu Z.; Han Q.,CLG-Trans: Contrastive learning for code summarization via graph attention-based transformer,"Automated code summarization is the task of automatically generating natural language descriptions of source code, which is an important research topic in the software engineering field. Many methods in recent studies were based on deep learning techniques, which effectively improve the performance of code summarization. Most of the existing code summarization methods use different kinds of neural networks to learn source code information. Some methods use graph neural network (GNN) to represent abstract syntax tree (AST) and fuse the structural information of source code. However, these methods still have two important issues: 1) they cannot solve the Out-Of-Vocabulary (OOV) problem effectively; 2) the structural information of source code they can capture is limited. In order to address the above-mentioned challenges, we propose a novel automated code summarization model named CLG-Trans in this work. This model uses the Byte Pair Encoding (BPE) algorithm and pointer-generator network to tackle the OOV problem. Then it utilizes the fusion of contrastive learning strategy and dynamic graph attention mechanism to effectively capture rich structure information of source code sequences. Experimental results on Funcom dataset show that CLG-Trans outperforms seven state-of-the-art models (i.e., Hybrid-DRL, Ast-Attendgru, Transformer, codeGnn, Rencos, CodeBERT and SIT) by averagely increasing 19.48% and 13.17% on BLEU scores and ROUGUE-L score, respectively. In addition, CLG-Trans achieves an improvement of 16.14% and 4.70% in BLEU scores and ROUGE-L score compared with our previously proposed model DG-Trans. © 2023 Elsevier B.V.",Article,2023,https://www.scopus.com/inward/record.uri?eid=2-s2.0-85146339240&doi=10.1016%2fj.scico.2023.102925&partnerID=40&md5=4eafb730187cf493a6ec32d10b197f44,Science of Computer Programming,150,Include,I1.1,
Li J.; Wang X.; Lyu C.,ACAGNN: Source Code Representation Based on Fine-Grained Multi-view Program Features,"Existing program comprehension models represent a single code feature and coarse code granularity. They tend to consider the shal- low features of source code (e.g., method names, characters, etc.) and ignore the structured features of source code such as Abstract Syntax Tree (AST), Control Flow Graph (CFG), and Application Programming Interface Dependency Graph (ADG), resulting in an incomplete representation of the source code. Although there are approaches to model ASTs, ASTs are efficient in representing code structure information. They have shortcomings in capturing the calling relationships of methods in the code for the entire class library, which does not allow the model to represent the global program accurately. To address these issues, we propose a multi-view source code representation model called ACAGNN, which uses a designed matching mechanism to learn multi-view code structure representation at the node-level and apply it to downstream code classification tasks. © 2023, The Author(s), under exclusive license to Springer Nature Singapore Pte Ltd.",Conference paper,2023,https://www.scopus.com/inward/record.uri?eid=2-s2.0-85161117660&doi=10.1007%2f978-981-99-2385-4_36&partnerID=40&md5=06b6e73732a56c7c7766badf6fe78300,Communications in Computer and Information Science,151,Include,I1.1,
