Authors,Title,Abstract,Document Type,Year,Link,Source title,Round 3 ID,Included/Excluded,Reason,Notes
Ling X.; Wu L.; Wang S.; Pan G.; Ma T.; Xu F.; Liu A.X.; Wu C.; Ji S.,Deep Graph Matching and Searching for Semantic Code Retrieval,"Code retrieval is to find the code snippet from a large corpus of source code repositories that highly matches the query of natural language description. Recent work mainly uses natural language processing techniques to process both query texts (i.e., human natural language) and code snippets (i.e., machine programming language), however, neglecting the deep structured features of query texts and source codes, both of which contain rich semantic information. In this article, we propose an end-to-end deep graph matching and searching (DGMS) model based on graph neural networks for the task of semantic code retrieval. To this end, we first represent both natural language query texts and programming language code snippets with the unified graph-structured data, and then use the proposed graph matching and searching model to retrieve the best matching code snippet. In particular, DGMS not only captures more structural information for individual query texts or code snippets, but also learns the fine-grained similarity between them by cross-attention based semantic matching operations. We evaluate the proposed DGMS model on two public code retrieval datasets with two representative programming languages (i.e., Java and Python). Experiment results demonstrate that DGMS significantly outperforms state-of-the-art baseline models by a large margin on both datasets. Moreover, our extensive ablation studies systematically investigate and illustrate the impact of each part of DGMS. © 2021 ACM.",Article,2021,https://www.scopus.com/inward/record.uri?eid=2-s2.0-85108944290&doi=10.1145%2f3447571&partnerID=40&md5=14c8a672080f2758dab68933fd5645df,ACM Transactions on Knowledge Discovery from Data,193,Include,Continues work from 190/253,
Wan Y.; Shu J.; Sui Y.; Xu G.; Zhao Z.; Wu J.; Yu P.,Multi-modal attention network learning for semantic source code retrieval,"Code retrieval techniques and tools have been playing a key role in facilitating software developers to retrieve existing code fragments from available open-source repositories given a user query (e.g., a short natural language text describing the functionality for retrieving a particular code snippet). Despite the existing efforts in improving the effectiveness of code retrieval, there are still two main issues hindering them from being used to accurately retrieve satisfiable code fragments from large-scale repositories when answering complicated queries. First, the existing approaches only consider shallow features of source code such as method names and code tokens, but ignoring structured features such as abstract syntax trees (ASTs) and control-flow graphs (CFGs) of source code, which contains rich and well-defined semantics of source code. Second, although the deep learning-based approach performs well on the representation of source code, it lacks the explainability, making it hard to interpret the retrieval results and almost impossible to understand which features of source code contribute more to the final results. To tackle the two aforementioned issues, this paper proposes MMAN, a novel Multi-Modal Attention Network for semantic source code retrieval. A comprehensive multi-modal representation is developed for representing unstructured and structured features of source code, with one LSTM for the sequential tokens of code, a Tree-LSTM for the AST of code and a GGNN (Gated Graph Neural Network) for the CFG of code. Furthermore, a multi-modal attention fusion layer is applied to assign weights to different parts of each modality of source code and then integrate them into a single hybrid representation. Comprehensive experiments and analysis on a large-scale real-world dataset show that our proposed model can accurately retrieve code snippets and outperforms the state-of-the-art methods. © 2019 IEEE.",Conference paper,2019,https://www.scopus.com/inward/record.uri?eid=2-s2.0-85074667252&doi=10.1109%2fASE.2019.00012&partnerID=40&md5=091ed6e4921d176bf474c05372e6bc36,"Proceedings - 2019 34th IEEE/ACM International Conference on Automated Software Engineering, ASE 2019",194,Include,I1.1,
Mehrotra N.; Sharma A.; Jindal A.; Purandare R.,Improving Cross-Language Code Clone Detection via Code Representation Learning and Graph Neural Networks,"Code clone detection is an important aspect of software development and maintenance. The extensive research in this domain has helped reduce the complexity and increase the robustness of source code, thereby assisting bug detection tools. However, the majority of the clone detection literature is confined to a single language. With the increasing prevalence of cross-platform applications, functionality replication across multiple languages is common, resulting in code fragments having similar functionality but belonging to different languages. Since such clones are syntactically unrelated, single language clone detection tools are not applicable in their case. In this article, we propose a semi-supervised deep learning-based tool Rubhus, capable of detecting clones across different programming languages. Rubhus uses the control and data flow enriched abstract syntax trees (ASTs) of code fragments to leverage their syntactic and structural information and then applies graph neural networks (GNNs) to extract this information for the task of clone detection. We demonstrate the effectiveness of our proposed system through experiments conducted over datasets consisting of Java, C, and Python programs and evaluate its performance in terms of precision, recall, and F1 score. Our results indicate that Rubhus outperforms the state-of-the-art cross-language clone detection tools.  © 1976-2012 IEEE.",Article,2023,https://www.scopus.com/inward/record.uri?eid=2-s2.0-85171552856&doi=10.1109%2fTSE.2023.3311796&partnerID=40&md5=184af2dea409f1cc30a0e20bdf4e97d8,IEEE Transactions on Software Engineering,195,Include,I1.1,
Yu D.; Yang Q.; Chen X.; Chen J.; Xu Y.,Graph-based code semantics learning for efficient semantic code clone detection,"Recent studies have shown that high-quality code semantics learning can effectively improve the performance of code clone detection. However, existing approaches suffer from two major drawbacks: (a) insufficient utilization of code representations, leading to inefficient semantics learning, and (b) low efficiency of clone detection, resulting in massive detection time. Therefore, we are motivated to propose an efficient semantics learning method while speeding up the detection process. Specifically, to address the first one, we adopt either CFG (Control Flow Graph) or PDG (Program Dependency Graph) as our initial code representation because of their rich semantic information. Further, we propose a novel graph-based code semantics learning method, which can capture critical information at token, statement, edge, and graph levels. To address the second one, we design a Siamese graph-matching network based on attention mechanisms. It can uniformly generate graph embeddings for code fragments and facilitate parallel detection of semantic clones, thus significantly boosting the speed of semantic clone detection. We evaluated our approach on two Java benchmark datasets, Google Code Jam and BigCloneBench. The experimental results show that our model outperforms the SOTA (State-Of-The-Art) lightweight models and is over 20x faster in detection. In addition, our model performs on par with the large Bert-based models and is over 110x faster in detection. Our code and dataset are available online at: https://github.com/HduDBSI/CodeGraph4CCDetector. © 2022",Article,2023,https://www.scopus.com/inward/record.uri?eid=2-s2.0-85144452421&doi=10.1016%2fj.infsof.2022.107130&partnerID=40&md5=6e1b8c80ca04b3a15872a41e4d6a3a30,Information and Software Technology,196,Include,I1.1,
Dai L.,A study on the application of graph neural network in code clone detection: Improving the performance of code clone detection through graph neural networks and attention mechanisms,"With the increasing scale of software and the growing number of software developers, code cloning has become an important issue in software engineering. To detect code clones, this paper proposes a new method that converts source code into an Abstract Syntax Tree (AST), then adds edges from the Control Flow Graph (CFG) and Data Flow Graph (DFG) to the AST to form a graph. We then feed the graph into the Graph Matching Network (GMN) model and Pairwise Node Comparison (PNC) captures the edge and node information of the graph to calculate the graph similarity, thus converting code clone detection into a binary classification problem. Finally, experiments are conducted on the public dataset BigCloneBench, and the results show that the proposed method has high accuracy and scalability in code clone detection relative to other methods. © 2023 ACM.",Conference paper,2023,https://www.scopus.com/inward/record.uri?eid=2-s2.0-85169707859&doi=10.1145%2f3605801.3605834&partnerID=40&md5=c24ef0d4d173cbc93d0289bd51b243ab,ACM International Conference Proceeding Series,197,Include,I1.1,
Mehrotra N.; Agarwal N.; Gupta P.; Anand S.; Lo D.; Purandare R.,Modeling Functional Similarity in Source Code With Graph-Based Siamese Networks,"Code clones are duplicate code fragments that share (nearly) similar syntax or semantics. Code clone detection plays an important role in software maintenance, code refactoring, and reuse. A substantial amount of research has been conducted in the past to detect clones. A majority of these approaches use lexical and syntactic information to detect clones. However, only a few of them target semantic clones. Recently, motivated by the success of deep learning models in other fields, including natural language processing and computer vision, researchers have attempted to adopt deep learning techniques to detect code clones. These approaches use lexical information (tokens) and(or) syntactic structures like abstract syntax trees (ASTs) to detect code clones. However, they do not make sufficient use of the available structural and semantic information, hence limiting their capabilities. This paper addresses the problem of semantic code clone detection using program dependency graphs and geometric neural networks, leveraging the structured syntactic and semantic information. We have developed a prototype tool Holmes, based on our novel approach and empirically evaluated it on popular code clone benchmarks. Our results show that Holmes performs considerably better than the other state-of-the-art tool, TBCCD. We also assessed Holmes on unseen projects and performed cross dataset experiments to evaluate the generalizability of Holmes. Our results affirm that Holmes outperforms TBCCD since most of the pairs that Holmes detected were either undetected or suboptimally reported by TBCCD. © 1976-2012 IEEE.",Article,2022,https://www.scopus.com/inward/record.uri?eid=2-s2.0-85113236624&doi=10.1109%2fTSE.2021.3105556&partnerID=40&md5=23c76e79cd41b745e2448d8240e34e32,IEEE Transactions on Software Engineering,198,Include,I1.1,
Hu Y.; Zou D.; Peng J.; Wu Y.; Shan J.; Jin H.,TreeCen: Building Tree Graph for Scalable Semantic Code Clone Detection,"Code clone detection is an important research problem that has attracted wide attention in software engineering. Many methods have been proposed for detecting code clone, among which text-based and token-based approaches are scalable but lack consideration of code semantics, thus resulting in the inability to detect semantic code clones. Methods based on intermediate representations of codes can solve the problem of semantic code clone detection. However, graph-based methods are not practicable due to code compilation, and existing tree-based approaches are limited by the scale of trees for scalable code clone detection. In this paper, we propose TreeCen, a scalable tree-based code clone detector, which satisfies scalability while detecting semantic clones effectively. Given the source code of a method, we first extract its abstract syntax tree (AST) based on static analysis and transform it into a simple graph representation (i.e., tree graph) according to the node type, rather than using traditional heavyweight tree matching. We then treat the tree graph as a social network and adopt centrality analysis on each node to maintain the tree details. By this, the original complex tree can be converted into a 72-dimensional vector while containing comprehensive structural information of the AST. Finally, these vectors are fed into a machine learning model to train a detector and use it to find code clones. We conduct comparative evaluations on effectiveness and scalability. The experimental results show that TreeCen maintains the best performance of the other six state-of-the-art methods (i.e., SourcererCC, RtvNN, DeepSim, SCDetector, Deckard, and ASTNN) with F1 scores of 0.99 and 0.95 on BigCloneBench and Google Code Jam datasets, respectively. In terms of scalability, TreeCen is about 79 times faster than the other state-of-the-art tree-based semantic code clone detector (ASTNN), about 13 times faster than the fastest graph-based approach (SCDetector), and even about 22 times faster than the one-time trained token-based detector (RtvNN).  © 2022 ACM.",Conference paper,2022,https://www.scopus.com/inward/record.uri?eid=2-s2.0-85146924679&doi=10.1145%2f3551349.3556927&partnerID=40&md5=276d014d1c9463673e20d8750580700a,ACM International Conference Proceeding Series,199,Include,"I1.1,I1.2",
Liu H.; Zhao H.; Han C.; Hou L.,Low-Complexity Code Clone Detection using Graph-based Neural Networks,"Code clone detection is of great significance for intellectual property protection and software maintenance. Deep learning has been applied in some research and achieved better performance than traditional methods. To adapt to more application scenarios and improve the detection efficiency, this paper proposes a low-complex code clone detection with the graph- based neural network. As the input of the neural network, code features are represented by abstract syntax trees (ASTs), in which the redundant edges are removed. The operation of pruning avoids interference in the message passing of the network and reduces the size of the graph. Then, the graph pairs for the code clone detection are sent into the message passing neural networks (MPNN). In addition, the gated recurrent unit (GRU) is used to learn the information between graph pairs to avoid the operation of Graph mapping. After multiple iterations, the attention mechanism is used to read out the graph vector, and the cosine similarity is calculated on the graph vector to obtain the code similarity. Through the experiments on two datasets, the results show that the proposed clone detection scheme removes about 20 % of the redundant edges and reduces 25 % of model weights, 16% of multiply-accumulate operations (MACs). In the end, the proposed method effectively reduces the training time of graph neural network while presenting a similar performance to the baseline network. © 2022 IEEE.",Conference paper,2022,https://www.scopus.com/inward/record.uri?eid=2-s2.0-85152299989&doi=10.1109%2fMSN57253.2022.00129&partnerID=40&md5=9f953d397742cd6b27e23a5711dbace7,"Proceedings - 2022 18th International Conference on Mobility, Sensing and Networking, MSN 2022",200,Include,"I1.1,I1.2",
Hu B.; Wu Y.; Peng X.; Sha C.; Wang X.; Fu B.; Zhao W.,Predicting Change Propagation between Code Clone Instances by Graph-based Deep Learning,"Code clones widely exist in open-source and industrial software projects and are still recognized as a threat to software main-tenance due to the additional effort required for the simultaneous maintenance of multiple clone instances and potential defects caused by inconsistent changes in clone instances. To alleviate the threat, it is essential to accurately and efficiently make the decisions of change propagation between clone instances. Based on an exploratory study on clone change propagation with five famous open-source projects, we find that a clone class can have both propagation-required changes and propagation-free changes and thus fine-grained change propagation decision is required. Based on the findings, we propose a graph-based deep learning approach to predict the change propagation requirements of clone instances. We develop a graph representation, named Fused Clone Program Dependency Graph (FC-PDG), to capture the textual and structural code contexts of a pair of clone instances along with the changes on one of them. Based on the representation, we design a deep learning model that uses a Relational Graph Convolutional Network (R-GCN) to predict the change propagation requirement. We evaluate the approach with a dataset constructed based on 51 open-source Java projects, which includes 24,672 pairs of matched changes and 38,041 non-matched changes. The results show that the approach achieves high precision (83.1%), recall (81.2%), and F1-score (82.1%). Our further evaluation with three other open-source projects confirms the generality of the trained clone change propagation prediction model.  © 2022 ACM.",Conference paper,2022,https://www.scopus.com/inward/record.uri?eid=2-s2.0-85133200335&doi=10.1145%2f3524610.3527766&partnerID=40&md5=8c8aeedb22b2c682a2e4551b6716b887,IEEE International Conference on Program Comprehension,201,Include,"I1.1,I1.2",
Lu Z.; Li R.; Hu H.; Zhou W.-A.,A code clone detection algorithm based on graph convolution network with AST tree edge,"Detecting code cloning will prevent it from bringing risks such as vulnerabilities and intellectual property disputes in complex software systems such as large-scale defense software systems and commercial software systems. In the field of deep code clone detection, neural networks such as Tree-CNN and Tree-LSTM, which extract features from AST (abstract syntax tree), can't collect global information of upper and lower nodes, and information can't flow globally, but graph neural network can avoid this problem. This paper presents a method of edging AST, and uses GCN (Graph Convolutional Network) and GAT(Graph Attention Networks) to extract code feature vector. Finally, the experiment is carried out on BigCloneBench data set, using several common binary classification indexes, and analyzing the time consumption, it is concluded that the effect and time efficiency of using graph neural network for code clone detection are significantly improved, especially for the code fragments with completely different semantics.  © 2021 IEEE.",Conference paper,2021,https://www.scopus.com/inward/record.uri?eid=2-s2.0-85140923450&doi=10.1109%2fQRS-C55045.2021.00156&partnerID=40&md5=cdb1920d1758a453955a77a6c54f6ec9,"Proceedings - 2021 21st International Conference on Software Quality, Reliability and Security Companion, QRS-C 2021",202,Include,"I1.1,I1.2",
Xu K.; Liu Y.,SCCD-GAN: An Enhanced Semantic Code Clone Detection Model Using GAN,"Code clone refers to a pair of semantically similar but syntactically similar or different code fragments that exist in code base. Excessive code clones in software system will cause a negative impact on system development and maintenance. In recent years, as deep learning has become a hot research area of machine learning, researchers have tried to apply deep learning techniques to code clone detection tasks. They have proposed a series of detection techniques using including unstructured (code in the form of sequential tokens) and structured (code in the form of abstract syntax trees and control-flow graphs) information to detect semantically similar but syntactically different code clone, which is the most difïîcult-to-detect clone type. However, although these methods have achieved an important improvement in the precision of semantic code clone detection, the corresponding false positive rate(FPR) is also at a very high level, making these methods unable to be effectively applied to real-world code bases. This paper proposed S C C D - G A N, an enhanced semantic code clone detection model which based on a graph representation form of programs and uses Graph Attention Network to measure the similarity of code pairs and achieved a lower detection F P R than existing methods. We built the graph representation of the code by expanding the control flow and data flow information to the original abstract syntax tree, and equipped with an attention mechanism to our model that focuses on the most important code parts and features which contribute much to the final detection precision. We implemented and evaluated our proposed method based on the benchmark dataset in the field of code clone detectionBigCloneBench2 and Google Code Jam. S C C D - G A N performed better than the existing state-of-the-art methods in terms of precision and false positive rate. ©2021 IEEE",Conference paper,2021,https://www.scopus.com/inward/record.uri?eid=2-s2.0-85125205818&doi=10.1109%2fICECE54449.2021.9674552&partnerID=40&md5=f22e2f0159ad2ce1329266e99268e3e1,"2021 IEEE 4th International Conference on Electronics and Communication Engineering, ICECE 2021",203,Include,"I1.1,I1.2",
Wu Y.; Zou D.; Dou S.; Yang S.; Yang W.; Cheng F.; Liang H.; Jin H.,SCDetector: Software Functional Clone Detection Based on Semantic Tokens Analysis,"Code clone detection is to find out code fragments with similar functionalities, which has been more and more important in software engineering. Many approaches have been proposed to detect code clones, in which token-based methods are the most scalable but cannot handle semantic clones because of the lack of consideration of program semantics. To address the issue, researchers conduct program analysis to distill the program semantics into a graph representation and detect clones by matching the graphs. However, such approaches suffer from low scalability since graph matching is typically time-consuming. In this paper, we propose SCDetector to combine the scalability of token-based methods with the accuracy of graph-based methods for software functional clone detection. Given a function source code, we first extract the control flow graph by static analysis. Instead of using traditional heavyweight graph matching, we treat the graph as a social network and apply social-network-centrality analysis to dig out the centrality of each basic block. Then we assign the centrality to each token in a basic block and sum the centrality ofthe same token in different basic blocks. By this, a graph is turned into certain tokens with graph details (i.e., centrality), called semantic tokens. Finally, these semantic tokens are fed into a Siamese architecture neural network to train a code clone detector. We evaluate SCDetector on two large datasets of functionally similar code. Experimental results indicate that our system is superior to four state-of-the-art methods (i.e., SourcererCC, Deckard, RtvNN, and ASTNN) and the time cost of SCDetector is 14 times less than a traditional graph-based method (i.e., CCSharp) on detecting semantic clones. © 2020 ACM.",Conference paper,2020,https://www.scopus.com/inward/record.uri?eid=2-s2.0-85099212810&doi=10.1145%2f3324884.3416562&partnerID=40&md5=7637baf6c518b1c7013ceb5c4b83a3ee,"Proceedings - 2020 35th IEEE/ACM International Conference on Automated Software Engineering, ASE 2020",204,Include,I1.1,
Wang W.; Li G.; Ma B.; Xia X.; Jin Z.,Detecting Code Clones with Graph Neural Network and Flow-Augmented Abstract Syntax Tree,"Code clones are semantically similar code fragments pairs that are syntactically similar or different. Detection of code clones can help to reduce the cost of software maintenance and prevent bugs. Numerous approaches of detecting code clones have been proposed previously, but most of them focus on detecting syntactic clones and do not work well on semantic clones with different syntactic features. To detect semantic clones, researchers have tried to adopt deep learning for code clone detection to automatically learn latent semantic features from data. Especially, to leverage grammar information, several approaches used abstract syntax trees (AST) as input and achieved significant progress on code clone benchmarks in various programming languages. However, these AST-based approaches still can not fully leverage the structural information of code fragments, especially semantic information such as control flow and data flow. To leverage control and data flow information, in this paper, we build a graph representation of programs called flow-augmented abstract syntax tree (FA-AST). We construct FA-AST by augmenting original ASTs with explicit control and data flow edges. Then we apply two different types of graph neural networks (GNN) on FA-AST to measure the similarity of code pairs. As far as we have concerned, we are the first to apply graph neural networks on the domain of code clone detection. We apply our FA-AST and graph neural networks on two Java datasets: Google Code Jam and BigCloneBench. Our approach outperforms the state-of-the-art approaches on both Google Code Jam and BigCloneBench tasks. © 2020 IEEE.",Conference paper,2020,https://www.scopus.com/inward/record.uri?eid=2-s2.0-85083565137&doi=10.1109%2fSANER48275.2020.9054857&partnerID=40&md5=bf82acc679eee5776a729dba7d685a8d,"SANER 2020 - Proceedings of the 2020 IEEE 27th International Conference on Software Analysis, Evolution, and Reengineering",205,Include,"I1.1,I1.2",
